<?xml version="1.0" encoding="UTF-8"?>
<instance name="Monastery Of Silence" xmlns:xsi="http://www.w3.org/2001/XMLSchema-instance" xsi:noNamespaceSchemaLocation="../xsd/instance.xsd">
	<activityTime val="30" />
	<allowSummon val="false" />
	<emptyDestroyTime val="1" />
	<spawnPoint spawnX="115983" spawnY="-87351" spawnZ="-3397" />
	<spawnlist>
		<group name="general">
			<!-- Eris's Evil Thoughts -->
			<spawn npcId="32792" x="120881" y="-86496" z="-3392" heading="49080" respawn="0" />
			<!-- Relic Guardian -->
			<spawn npcId="32803" x="85792" y="-249624" z="-8296" heading="0" respawn="0" />
			<!-- Teleport Control Device -->
			<spawn npcId="32817" x="86674" y="-249624" z="-8296" heading="32960" respawn="0" />
			<spawn npcId="32818" x="84909" y="-249625" z="-8296" heading="0" respawn="0" />
			<spawn npcId="32819" x="85792" y="-250512" z="-8296" heading="16400" respawn="0" />
			<spawn npcId="32820" x="85792" y="-248739" z="-8296" heading="49212" respawn="0" />
			<!-- Relic Watcher -->
			<spawn npcId="32804" x="88672" y="-249625" z="-8296" heading="32592" respawn="0" />
			<spawn npcId="32805" x="82528" y="-249616" z="-8296" heading="0" respawn="0" />
			<spawn npcId="32806" x="85788" y="-252497" z="-8296" heading="16852" respawn="0" />
			<spawn npcId="32807" x="85790" y="-246730" z="-8296" heading="48120" respawn="0" />
			<!-- Reading Desk -->
			<spawn npcId="32821" x="88664" y="-250731" z="-8320" heading="0" respawn="0" />
			<spawn npcId="32822" x="89775" y="-249620" z="-8320" heading="0" respawn="0" />
			<spawn npcId="32823" x="88662" y="-248537" z="-8320" heading="0" respawn="0" />
			<spawn npcId="32824" x="87584" y="-249626" z="-8320" heading="0" respawn="0" />
			<spawn npcId="32825" x="82528" y="-250734" z="-8320" heading="0" respawn="0" />
			<spawn npcId="32826" x="83630" y="-249615" z="-8320" heading="0" respawn="0" />
			<spawn npcId="32827" x="82525" y="-248525" z="-8320" heading="0" respawn="0" />
			<spawn npcId="32828" x="81441" y="-249621" z="-8320" heading="0" respawn="0" />
			<spawn npcId="32829" x="85793" y="-253611" z="-8320" heading="0" respawn="0" />
			<spawn npcId="32830" x="86904" y="-252506" z="-8320" heading="0" respawn="0" />
			<spawn npcId="32831" x="85789" y="-251429" z="-8320" heading="0" respawn="0" />
			<spawn npcId="32832" x="84712" y="-252512" z="-8320" heading="0" respawn="0" />
			<spawn npcId="32833" x="85790" y="-247830" z="-8320" heading="0" respawn="0" />
			<spawn npcId="32834" x="86888" y="-246734" z="-8320" heading="0" respawn="0" />
			<spawn npcId="32835" x="85793" y="-245640" z="-8320" heading="0" respawn="0" />
			<spawn npcId="32836" x="84705" y="-246730" z="-8320" heading="0" respawn="0" />
		</group>
	</spawnlist>
</instance>